{
  "$schema":"https://json-schema.org/draft/2020-12/schema","type":"object",
  "required":["schema","sequence","event_type","round","prev_anchor_event_sha256","private_repo","private_branch","private_commit_sha","previous_release_registry_head_sha256","previous_round_ledger_head_sha256","release_registry_head_sha256","round_ledger_head_sha256","release_registry_tail","round_ledger_tail","authority_sha256","authority_tsr_sha256"],
  "properties":{"schema":{"const":"M8_PUBLIC_ANCHOR_RECORD_V1"},"sequence":{"type":"integer","minimum":1},"event_type":{"type":"string"},"round":{"type":["integer","null"]},"prev_anchor_event_sha256":{"type":"string"},"private_repo":{"type":"string"},"private_branch":{"type":"string"},"private_commit_sha":{"type":"string","pattern":"^[0-9a-f]{40}$"},"previous_release_registry_head_sha256":{"type":"string"},"previous_round_ledger_head_sha256":{"type":"string"},"release_registry_head_sha256":{"type":"string"},"round_ledger_head_sha256":{"type":"string"},"release_registry_tail":{"type":"array"},"round_ledger_tail":{"type":"array"},"authority_sha256":{"type":["string","null"]},"authority_tsr_sha256":{"type":["string","null"]}},"additionalProperties":false
}
