{"authority_sha256":"e7877f3c33bd9b15d230671c2b3722522eec1a58c763612c3ee9c2f92a1f2639","authority_tsr_sha256":"c363537d0faff93d46766d7f3d51557aeb31706c75410c2f4090cd33391e1d73","event_type":"PREDRAW_REGISTERED","prev_anchor_event_sha256":"GENESIS","previous_release_registry_head_sha256":"GENESIS","previous_round_ledger_head_sha256":"GENESIS","private_branch":"rehearsal-v7-r333-r2","private_commit_sha":"7bb4bb1654090fcd26d5f397216f5a33146fc4f5","private_repo":"soriom1/m8-lotto","release_registry_head_sha256":"a5555d1b4d26dc692ed7a3d7901cffc6a8ef3c628ea1571d5cdf7a7ec4c107c5","release_registry_tail":[{"event_hash":"a5555d1b4d26dc692ed7a3d7901cffc6a8ef3c628ea1571d5cdf7a7ec4c107c5","event_type":"RELEASE_APPROVED","prev_event_sha256":"GENESIS","round":null}],"round":1244,"round_ledger_head_sha256":"85667bb47ad3806d4a9db2408c9168aeb2fa192b395c5db810e0c8a326d42a1f","round_ledger_tail":[{"event_hash":"85667bb47ad3806d4a9db2408c9168aeb2fa192b395c5db810e0c8a326d42a1f","event_type":"PREDRAW_REGISTERED","prev_event_sha256":"GENESIS","round":1244}],"schema":"M8_PUBLIC_ANCHOR_RECORD_V1","sequence":1}
