{"authority_sha256":null,"authority_tsr_sha256":null,"event_type":"RELEASE_CHANGED","prev_anchor_event_sha256":"384f4634a59f62b0550ac2392c7709a6e6a709062d21899e9296614cf8eb0a5e","previous_release_registry_head_sha256":"3e947d77e56e15a8873724a29359054ac7e1d9f2673766f1e4a7f1f692e14381","previous_round_ledger_head_sha256":"GENESIS","private_branch":"main","private_commit_sha":"18c2e427ae0c308fe0ac4c68b09fa253ce149b53","private_repo":"soriom1/m8-lotto","release_registry_head_sha256":"4138cdba2a0fbbd3b01d05ce4f1a398ed74194c3d655fedb127bf3c4a23a7e3d","release_registry_tail":[{"event_hash":"7394330f3227f95db2fb573f2ade38d9df1f03ae1f7dac21400600dbb2fc7130","event_type":"RELEASE_APPROVED","prev_event_sha256":"3e947d77e56e15a8873724a29359054ac7e1d9f2673766f1e4a7f1f692e14381","round":null},{"event_hash":"4138cdba2a0fbbd3b01d05ce4f1a398ed74194c3d655fedb127bf3c4a23a7e3d","event_type":"RELEASE_APPROVED","prev_event_sha256":"7394330f3227f95db2fb573f2ade38d9df1f03ae1f7dac21400600dbb2fc7130","round":null}],"round":null,"round_ledger_head_sha256":"73919da8c68f64ca01be0d926c34c62469d3e167eb36b3601afdfd675dd0ef95","round_ledger_tail":[{"event_hash":"73919da8c68f64ca01be0d926c34c62469d3e167eb36b3601afdfd675dd0ef95","event_type":"PREDRAW_REGISTERED","prev_event_sha256":"GENESIS","round":1244}],"schema":"M8_PUBLIC_ANCHOR_RECORD_V1","sequence":3}
