{"authority_sha256":null,"authority_tsr_sha256":null,"event_type":"RELEASE_CHANGED","prev_anchor_event_sha256":"c6abe0e3ef09640d4973f80870c7510c43b2250e6823631baed1286bf455e5c8","previous_release_registry_head_sha256":"a5555d1b4d26dc692ed7a3d7901cffc6a8ef3c628ea1571d5cdf7a7ec4c107c5","previous_round_ledger_head_sha256":"GENESIS","private_branch":"main","private_commit_sha":"18c2e69a6676531799056bd5945149091f100bc7","private_repo":"soriom1/m8-lotto","release_registry_head_sha256":"3e947d77e56e15a8873724a29359054ac7e1d9f2673766f1e4a7f1f692e14381","release_registry_tail":[{"event_hash":"3e947d77e56e15a8873724a29359054ac7e1d9f2673766f1e4a7f1f692e14381","event_type":"RELEASE_APPROVED","prev_event_sha256":"a5555d1b4d26dc692ed7a3d7901cffc6a8ef3c628ea1571d5cdf7a7ec4c107c5","round":null}],"round":null,"round_ledger_head_sha256":"GENESIS","round_ledger_tail":[],"schema":"M8_PUBLIC_ANCHOR_RECORD_V1","sequence":2}
