{"authority_sha256":"b0ac313a365f7de9838dfef89971ece270feab4de058630f4d25bef2699b8b3a","authority_tsr_sha256":"2d70e40320d9f10a7297b6ecfabadd798ca83b91a94b2227b9b579926af9cfe6","event_type":"PREDRAW_REGISTERED","prev_anchor_event_sha256":"fde6ecbaa829d5aedb735c3b2625f2714b422d0f7158000e9b9dbbf671cf328e","previous_release_registry_head_sha256":"4138cdba2a0fbbd3b01d05ce4f1a398ed74194c3d655fedb127bf3c4a23a7e3d","previous_round_ledger_head_sha256":"73919da8c68f64ca01be0d926c34c62469d3e167eb36b3601afdfd675dd0ef95","private_branch":"main","private_commit_sha":"d87691b7d5de553456b094522105bff606606c74","private_repo":"soriom1/m8-lotto","release_registry_head_sha256":"4138cdba2a0fbbd3b01d05ce4f1a398ed74194c3d655fedb127bf3c4a23a7e3d","release_registry_tail":[],"round":1245,"round_ledger_head_sha256":"8a3529857ee42122b3d877a50f5eb5d62d2131fe763646b5e19353297cc0ccba","round_ledger_tail":[{"event_hash":"8a3529857ee42122b3d877a50f5eb5d62d2131fe763646b5e19353297cc0ccba","event_type":"PREDRAW_REGISTERED","prev_event_sha256":"73919da8c68f64ca01be0d926c34c62469d3e167eb36b3601afdfd675dd0ef95","round":1245}],"schema":"M8_PUBLIC_ANCHOR_RECORD_V1","sequence":4}
